<?xml version="1.0" encoding="UTF-8"?>
<!DOCTYPE pkgmetadata SYSTEM "http://www.gentoo.org/dtd/metadata.dtd">
<pkgmetadata>
	<herd>sound</herd>
	<maintainer>
		<email>sping@gentoo.org</email>
		<name>Sebastian Pipping</name>
	</maintainer>
	<use>
		<flag name='audacious'>Include <pkg>media-sound/audacious</pkg> support</flag>
		<flag name='gtk3'>Link against <pkg>x11-libs/gtk+</pkg>:3 instead of <pkg>x11-libs/gtk+</pkg>:2</flag>
	</use>
</pkgmetadata>
