<?xml version="1.0" encoding="UTF-8"?>
<!DOCTYPE pkgmetadata SYSTEM "http://www.gentoo.org/dtd/metadata.dtd">
<pkgmetadata>
<herd>netmon</herd>
<longdescription>emulates the IP stack of Linux 2.0.x and offers IP defragmentation, TCP stream assembly and TCP port scan detection.</longdescription>
<use>
<flag name="glib">Use <pkg>dev-libs/glib</pkg> for multiprocessing support</flag>
<flag name="libnet">Include code requiring <pkg>net-libs/libnet</pkg></flag>
</use>
</pkgmetadata>
