<?xml version="1.0" encoding="UTF-8"?>
<!DOCTYPE pkgmetadata SYSTEM "http://www.gentoo.org/dtd/metadata.dtd">
<pkgmetadata>
	<herd>sci-chemistry</herd>
	<maintainer>
		<email>alexxy@gentoo.org</email>
		<name>Alexey Shvetsov</name>
	</maintainer>
	<use>
		<flag name="32bit">Automatically generated description for 32bit</flag>
		<flag name="64bit">Automatically generated description for 64bit</flag>
	</use>
</pkgmetadata>
