<?xml version="1.0" encoding="UTF-8"?>
<!DOCTYPE pkgmetadata SYSTEM "http://www.gentoo.org/dtd/metadata.dtd">
<pkgmetadata>
	<herd>fonts</herd>
	<maintainer>
		<email>yngwin@gentoo.org</email>
		<name>Ben de Groot</name>
	</maintainer>
	<maintainer>
		<email>multilib@gentoo.org</email>
		<name>gx86-multilib project</name>
		<description>Handling the bugs related to multilib support in the package and related changes.</description>
	</maintainer>
	<use>
		<flag name="auto-hinter">Use the unpatented auto-hinter instead
			of the (recommended) TrueType bytecode interpreter</flag>
		<flag name="bzip2">Support bzip2 compressed PCF fonts.</flag>
		<flag name="fontforge">Install internal headers required for TrueType
			debugger in <pkg>media-gfx/fontforge</pkg> (built with
			USE=truetype-debugger)</flag>
		<flag name="infinality">Enable infinality options for improved LCD
			filtering</flag>
		<flag name="utils">Install utilities and examples from ft2demos</flag>
	</use>
</pkgmetadata>
