<?xml version="1.0" encoding="UTF-8"?>
<!DOCTYPE pkgmetadata SYSTEM "http://www.gentoo.org/dtd/metadata.dtd">
<pkgmetadata>
<maintainer>
  <email>robbat2@gentoo.org</email>
</maintainer>
<maintainer>
	<email>nicolas@boichat.ch</email>
	<description>
		Upstream developer. Please CC on all bugs involving ddccontrol
		and ddccontrol-db.
	</description>
</maintainer>
<use>
 <flag name='ddcpci'>enable direct PCI memory access (the setuid ddcpci util)</flag>
</use>
</pkgmetadata>
