<?xml version="1.0" encoding="UTF-8"?>
<!DOCTYPE pkgmetadata SYSTEM "http://www.gentoo.org/dtd/metadata.dtd">
<pkgmetadata>
  <maintainer>
    <email>alexxy@gentoo.org</email>
    <name>Alexey Shvetsov</name>
  </maintainer>
  <herd>sci-chemistry</herd>
  <use>
    <flag name="neo">Enable NEO for nuclear basis support</flag>
    <flag name="pax_kernel">Make this package work on PAX kernels</flag>
    <flag name="qmmm-tinker">Enable tinker qmmm code</flag>
  </use>
</pkgmetadata>
