<?xml version="1.0" encoding="UTF-8"?>
<!DOCTYPE pkgmetadata SYSTEM "http://www.gentoo.org/dtd/metadata.dtd">
<pkgmetadata>
<herd>web-apps</herd>
<maintainer>
	<email>pva@gentoo.org</email>
	<name>Peter Volkov</name>
</maintainer>
 <upstream>
<maintainer>
	<email>d@hx.id.au</email>
	<name>David Hicks</name>
</maintainer>
 </upstream>
</pkgmetadata>
