<?xml version="1.0" encoding="UTF-8"?>
<!DOCTYPE pkgmetadata SYSTEM "http://www.gentoo.org/dtd/metadata.dtd">
<pkgmetadata>
	<herd>proxy-maintainers</herd>
	<maintainer>
		<email>blueboar@gentoo.org</email>
		<name>Vladimir Romanov</name>
		<description>Maintainer. Assign bugs to him</description>
	</maintainer>
	<maintainer>
		<email>pinkbyte@gentoo.org</email>
		<name>Sergey Popov</name>
		<description>Proxy maintainer. CC him on bugs</description>
	</maintainer>
</pkgmetadata>
