<?xml version="1.0" encoding="UTF-8"?>
<!DOCTYPE pkgmetadata SYSTEM "http://www.gentoo.org/dtd/metadata.dtd">
<pkgmetadata>
	<herd>proxy-maintainers</herd>
	<maintainer>
		<email>tomboy64@sina.cn</email>
		<description>Maintainer, assign bugs to him</description>
	</maintainer>
	<maintainer>
		<email>mrueg@gentoo.org</email>
		<name>Manuel RÃ¼ger</name>
	<description>Proxy-Maintainer, CC him on bugs</description>
	</maintainer>
	<longdescription lang="en">Sigil is a multi-platform WYSIWYG ebook editor.
		It is designed to edit books in ePub format.</longdescription>
	<upstream>
		<remote-id type="google-code">sigil</remote-id>
	</upstream>
</pkgmetadata>
