<?xml version="1.0" encoding="UTF-8"?>
<!DOCTYPE pkgmetadata SYSTEM "http://www.gentoo.org/dtd/metadata.dtd">
<pkgmetadata>
	<maintainer>
		<email>email@missionaccomplish.com</email>
		<name>Fernando V.</name>
	</maintainer>
	<maintainer>
		<email>blueness@gentoo.org</email>
		<name>Anthony G. Basile</name>
	</maintainer>
	<use>
		<flag name='logrotate'>Use app-admin/logrotate for rotating logs</flag>
	</use>
</pkgmetadata>
