<?xml version="1.0" encoding="UTF-8"?>
<!DOCTYPE pkgmetadata SYSTEM "http://www.gentoo.org/dtd/metadata.dtd">
<pkgmetadata>
<herd>qt</herd>
<maintainer>
	<email>hwoarang@gentoo.org</email>
	<name>Markos Chandras</name>
</maintainer>
<maintainer>
	<email>pesa@gentoo.org</email>
	<name>Davide Pesavento</name>
</maintainer>
<use>
	<flag name="android">Build Android plugin</flag>
	<flag name="autotools">Enable autotools project manager plugin</flag>
	<flag name="bazaar">Add support for <pkg>dev-vcs/bzr</pkg> version control system</flag>
	<flag name="botan-bundled">Use the bundled copy of <pkg>dev-libs/botan</pkg></flag>
	<flag name="clearcase">Add support for IBM ClearCase version control system (requires manual installation of ClearCase client)</flag>
	<flag name="cmake">Enable cmake project manager plugin</flag>
	<flag name="fakevim">Enable support for vim-like key bindings</flag>
	<flag name="git">Add support for <pkg>dev-vcs/git</pkg> version control system</flag>
	<flag name="madde">Enable integration with MADDE (Maemo Application Development and Debugging Environment)</flag>
	<flag name="mercurial">Add support for <pkg>dev-vcs/mercurial</pkg> version control system</flag>
	<flag name="perforce">Add support for Perforce version control system (requires manual installation of Perforce client)</flag>
	<flag name="qnx">Build QNX/Blackberry plugin</flag>
	<flag name="valgrind">Add support for memory debugging using <pkg>dev-util/valgrind</pkg></flag>
</use>
</pkgmetadata>
