<?xml version="1.0" encoding="UTF-8"?>
<!DOCTYPE pkgmetadata SYSTEM "http://www.gentoo.org/dtd/metadata.dtd">
<pkgmetadata>
	<herd>qt</herd>
	<use>
		<flag name="compat">Build the extra compatibility layer required by a few packages, see
			http://blog.qt.digia.com/blog/2010/06/22/qt-assistant-compat-version-available-as-extra-source-package/</flag>
		<flag name="exceptions">Add support for exceptions - like catching them
			inside the event loop (recommended by upstream)</flag>
	</use>
	<upstream>
		<bugs-to>https://bugreports.qt.io/</bugs-to>
		<doc>http://qt-project.org/doc/</doc>
	</upstream>
</pkgmetadata>
