<?xml version="1.0" encoding="UTF-8"?>
<!DOCTYPE pkgmetadata SYSTEM "http://www.gentoo.org/dtd/metadata.dtd">
<pkgmetadata>
  <herd>sci</herd>
  <herd>perl</herd>
  <maintainer>
    <email>weaver@gentoo.org</email>
    <name>Andrey Kislyuk</name>
  </maintainer>
  <upstream>
    <remote-id type="cpan">GBrowse</remote-id>
  </upstream>
</pkgmetadata>
