<?xml version="1.0" encoding="UTF-8"?>
<!DOCTYPE pkgmetadata SYSTEM "http://www.gentoo.org/dtd/metadata.dtd">
<pkgmetadata>
	<maintainer>
		<email>idella4@gentoo.org</email>
		<name>Ian Delaney</name>
	</maintainer>
	<herd>python</herd>
	<use>
		<flag name='bip'>An optional serialiser dev-python/biplist</flag>
		<flag name='digest'>Library to aid in implementing HTTP Digest Authentication</flag>
		<flag name='lxml'>An optional serialiser dev-python/lxml</flag>
		<flag name='oauth'>Adds OAuth authentication support</flag>
		<flag name='yaml'>An optional serialiser dev-python/yaml</flag>
	</use>
</pkgmetadata>

